"title","category","duration","channel","description","url"
"Poranna Joga na Dzień Dobry! 15 minut dla Ciała i Głowy!","Poranek, Flow, Kręgosłup, Wieczór","15","Małgorzata Mostowska","Poranna joga na dzień dobry to joga zarówno dla początkujących jak i zaawansowanych - inaczej mówiąc: ta joga będzie dobra dla każdego! :) To tylko 15 minut, więc chyba tyle czasu dla siebie znajdziesz? :)  Joga na dobry dzień to praktyka, która delikatnie lecz skutecznie, rozbudzi nasze ciało i umysł, jednak nie jest to tylko praktyka na rano, bowiem sprawdzi się o każdej porze, gdy potrzebujesz rozruszania ciała i wyciszenia umysłu.  To nieco krótsza, bo 15 minutowa sekwencja jogi, która sprawdzi się u osób nie mających wiele czasu z rana (bo umówmy się, mało kto go ma :)). Będziemy skupiać się na wzmacnianiu całego tułowia, rozruszaniu kręgosłupa i rozbudzeniu umysłu!  Joga w domu to wspaniała możliwość praktyki w dowolnym miejscu i czasie! Joga na dobry poranek to jest to!  Widzimy się na macie! :)   PS Poranna rutyna jest tak samo ważna jak ta wieczorna, dlatego zachęcam Cię również do praktyki jogi na dobry sen: https://www.youtube.com/watch?v=P7ioAZG1qJg&t=155s&ab_channel=Ma%C5%82gorzataMostowska   Pozostańmy w kontakcie: INSTAGRAM - https://www.instagram.com/gosiamostowska/ FACEBOOK - https://www.facebook.com/mmostowskayoga/ WWW - http://mmyoga.pl/ BLOG - http://purestyle.pl/ WSPÓŁPRACA: wspolpraca@mmyoga.pl  Wspieraj mnie:  https://patronite.pl/mmyoga  🖤  Jeśli podobał Ci się ten film, daj mi proszę dużego lajka, wtedy wiem, że to co robię, pomaga innym!  Jeśli chcesz pozostać na bieżąco, subskrybuj mój kanał i bądź automatycznie powiadamiany o nowych filmach! :)   Do zobaczenia już wkrótce! Gosia ♥","https://www.youtube.com/watch?v=TbLe0Zp-DGI"
"Joga na stres i niepokój - spokój i odprężenie w stylu YIN","Rozciąganie, Stres, Medytacja, Wieczór","22","Małgorzata Mostowska","Odprężająca joga na stres i niepokój to rozciąganie i wyciszenie w jednym. Praktyka, w której skupiamy się głównie na rozluźnianiu i relaksie - nie tylko mięśni, ale i (a może przede wszystkim!) umysłu. Ta praktyka to propozycja jogi w stylu YIN. Czyli będziemy nieco dłużej trwać w pozycjach.  Dlatego będzie to wspaniała propozycja dla osób, które potrzebują odprężenia, relaksu i łagodnego prowadzenia. Ta praktyka może być zatem potraktowana jako joga na sen.  To spokojna joga, która będzie idealna zarówno dla początkujących jak i bardziej zaawansowanych.   Yin Joga to rodzaj jogi, który charakteryzuje się dłuższym trwaniem w pozycjach, aby naprawdę poczuć jak dana pozycja wpływa na nasze ciało. Będzie zatem rozciąganie, spokojne tempo i relaksacja, dlatego załóż coś super wygodnego, rozłóż matę, wycisz telefon i przyszykuj się na nieco ponad 20 minut błogiego relaksu.   Pozostańmy w kontakcie:  INSTAGRAM - https://www.instagram.com/gosiamostowska/ FACEBOOK - https://www.facebook.com/mmostowskayoga/ WWW - http://mmyoga.pl/ BLOG - http://purestyle.pl/ WSPÓŁPRACA: wspolpraca@mmyoga.pl   Wspieraj mnie:  https://patronite.pl/mmyoga  🖤  Jeśli podobał Ci się ten film, daj mi proszę dużego lajka, wtedy wiem, że to co robię, pomaga innym!  Jeśli chcesz pozostać na bieżąco, subskrybuj mój kanał i bądź automatycznie powiadamiany o nowych filmach! :)   Do zobaczenia już wkrótce! Gosia ♥","https://www.youtube.com/watch?v=P7ioAZG1qJg"
"Poranna Joga na Rozruszanie - Ciało, Umysł i Limfa Flow!","Poranek, Flow, Stres","18","Małgorzata Mostowska","Poranna joga na rozruszanie - ciało, umysł i limfa flow to propozycja zarówno dla początkujących jak i zaawansowanych, jednym słowem: dla wszystkich! A zwłaszcza dla tych, którzy potrzebują rozruszać zastane po nocy ciało i pobudzić umysł! Wykorzystujemy do tego nie tylko jogę i asany lecz również ćwiczenia pozwalające na pobudzenie układu limfatycznego, co wywołuje ogrom korzyści w całym naszym ciele: od budowania odporności po prawidłową cyrkulację płynów ustrojowych. Krócej i prościej: dzięki takiemu drenażowi limfatycznemu będziesz zdrowszy/a i szczęśliwszy/a ;)  A jako że jest to joga w stylu Vinyasa Flow to będzie również kilka nieco bardziej dynamicznych ruchów z płynnymi przejściami oraz chwila na kontemplację otaczającej nas rzeczywistości.  Będzie również skupienie na oddechu, oraz chwili która istnieje naprawdę - tu i teraz.  To praktyka poranna, a jako że zazwyczaj o poranku nie mamy zbyt dużo czasu, trwa ona nieco ponad 15 minut. Mam nadzieję, że tyle czasu dla siebie znajdziesz :)  Miłego czasu na macie i poza nią!   Wspieraj mnie:  https://patronite.pl/mmyoga   Pozostańmy w kontakcie: INSTAGRAM - https://www.instagram.com/gosiamostowska/ FACEBOOK - https://www.facebook.com/mmostowskayoga/ WWW - http://mmyoga.pl/ BLOG - http://purestyle.pl/ GRUPA NA FB: http://tiny.pl/gpw9h  Jeśli podobał Ci się ten film, daj mi proszę dużego lajka, wtedy wiem, że to co robię, pomaga innym!  Jeśli chcesz pozostać na bieżąco, subskrybuj mój kanał i bądź automatycznie powiadamiany o nowych filmach! :)   Do zobaczenia już wkrótce! Gosia ♥","https://www.youtube.com/watch?v=zmAPnEmC6t0"
"Q&A z Gosią - sens życia, plan dnia, rozwój, macierzyństwo, trudności i radości","Stres, Wieczór","51","Małgorzata Mostowska","Cześć Kochani, przed Wami świeżutki film z cyklu q&a czyli 'pytania i odpowiedzi', pierwszy takie od ponad 3 lat! I pierwszy taki, w historii tego kanału, który trwa prawie godzinę! Wybaczcie, naprawdę nie dało się krócej :)   Pytań od Was pojawiło się znacznie więcej, jednak nie byłam w stanie odpowiedzieć na wszystkie (ile wtedy ten film by trwał?).  Powiem Wam, że naprawdę stęskniłam się za taką formą kontaktu i mam nadzieję, że chociaż raz do roku (haha) uda mi się nagrać dla Was taką pogadankę :)   To pogadanka,  w której dzielę się z Wami moimi życiowymi przemyśleniami, troskami i małymi radościami i... nie sądziłam, że wyjdzie tak melancholijnie. Z drugiej strony tak dawno już do Was nie mówiłam w takiej formie, że serio, przed nagraniem czułam jakiegoś rodzaju stres. Wyszło zdecydowanie (za)długo, a jednak podczas edycji nijak mogłam to skrócić. Zatem jeśli naprawdę macie dużo czasu (bo wyszła prawie godzinna pogadanka) to zapraszam Was z całego serca na bardzo życiowy q&a. Mam wrażenie, że różni się on mocno od tych pozostałych, które nagrywałam 4 i 5 lat temu i jednocześnie odczuwam, że jest taki prawdziwy i dość głęboki. Może jest to trochę o mnie i zmianach, które zaszły we mnie i w moim życiu, może jest to trochę o trudniejszym czasie i wielu emocjach, które towarzyszyły mi przed nagraniem, a może jeszcze o czymś innym…  Kochani, wybierzcie dla siebie z tych moich słów te, których teraz najbardziej potrzebujecie i które Was karmią. Bądźcie łagodni dla siebie (i dla mnie), patrzcie z jak największym spokojem na to co się wydarza i słuchajcie siebie. Zawsze. Ściskam Was i życzę Wam dużo kojących chwil ze sobą lub z bliskimi, tak jak lubicie.  Miłego oglądania czy też słuchania i... do zobaczenia na macie!  Mój IG: https://www.instagram.com/gosiamostowska/ Moja książka: https://linkd.pl/2sms4 Moje kursy i warsztaty: https://mmyoga.pl/ Moja Wioska: https://www.wioski.co/bliskilas   ________  Pozostańmy w kontakcie:   INSTAGRAM - https://www.instagram.com/gosiamostowska/  FACEBOOK - https://www.facebook.com/mmostowskayoga/  WWW - http://mmyoga.pl/  BLOG - http://purestyle.pl/  GRUPA NA FB: http://tiny.pl/gpw9h   Wspieraj mnie: https://patronite.pl/mmyoga  🖤   Jeśli podobał Ci się ten film, daj mi proszę dużego lajka, wtedy wiem, że to co robię, pomaga innym! Jeśli chcesz pozostać na bieżąco, subskrybuj mój kanał i bądź automatycznie powiadamiany o nowych filmach! :)   Do zobaczenia już wkrótce!  Gosia ♥","https://www.youtube.com/watch?v=4WrMSzagt1w"
"Medytacja Pozytywnych Afirmacji na Dobry Rok","Stres, Medytacja","9","Małgorzata Mostowska","Medytacja Pozytywnych Afirmacji na Dobry Rok to medytacja prowadzona, która ma być dla nas wszystkim wsparciem na każdy dzień. Medytacja bowiem zawiera w sobie spokojną muzykę, krótkie wprowadzenie, świadomy oddech i 11 pozytywnych afirmacji, które powtarzane często, a najlepiej codziennie mają sprawić, że poczujemy się lepiej, poczujemy ulgę, inspiracje i siłę wewnętrzną do zawalczenia o lepsze jutro.  Medytacja ma ukoić nasze nerwy, zrelaksować ciało i psychikę, oraz wyciszyć umysł. To medytacja opierająca się na poczuciu wdzięczności, spokoju i miłości - do siebie i do innych.   Ta praktyka będzie także odpowiednia dla początkujących, jako że jest to medytacja prowadzona. Możecie ją wykonać o każdej porze dnia i nocy, najbardziej polecam jednak sięgać po nią z samego rana i/lub tuż przed zaśnięciem. Ta praktyka to wspaniale zainwestowane w siebie zaledwie 10 minut!   Pięknej i głębokiej podróży, Kochani. _______  Muzyka: www.soundsofnidra.com Obraz: pixabay.com  Pozostańmy w kontakcie:   INSTAGRAM - https://www.instagram.com/gosiamostowska/  FACEBOOK - https://www.facebook.com/mmostowskayoga/  WWW - http://mmyoga.pl/  BLOG - http://purestyle.pl/  WSPÓŁPRACA: wspolpraca@mmyoga.pl  GRUPA NA FB: http://tiny.pl/gpw9h   Wspieraj mnie: https://patronite.pl/mmyoga  🖤   Jeśli podobał Ci się ten film, daj mi proszę dużego lajka, wtedy wiem, że to co robię, pomaga innym! Jeśli chcesz pozostać na bieżąco, subskrybuj mój kanał i bądź automatycznie powiadamiany o nowych filmach! :)   Do zobaczenia już wkrótce!  Gosia ♥","https://www.youtube.com/watch?v=zzhOpB1o0_0"
"Oddech i Wzmocnienie - Joga Flow dla Całego Ciała (Odc. 2)","Flow, Rozciąganie, Siła, Stres, Kręgosłup","22","Małgorzata Mostowska","Kochani, całość kursu znajdziecie tutaj:  https://mmyoga.pl/kurs/kurs-video/  🤍 __________  JOGA FLOW DLA CAŁEGO CIAŁA to program trwający 110 minut, który możesz wykonać na wiele sposobów. • W całości – jest to płynna i całościowa praktyka, każda część stanowi nawiązanie do tej poprzedniej. • W blokach - co jest w niej wyjątkowego – została podzielona na 4 części/bloki, które możesz wykonać samodzielnie lub dowolnie je ze sobą łączyć. Każdy z bloków pełni swoją rolę – jeden bardziej wycisza i koi układ nerwowy, rozluźnia i relaksuje mięśnie, a inny z kolei skupiony na mocnym oddechu i bardziej dynamicznych ruchach ma za zadanie nas rozbudzić, pobudzić i wywołać falę dobrych emocji, które zmotywują nas do dalszego działania.  Wszystkie części w połączeniu ze sobą tworzą synergię, uzupełniają się i wzbogacają. Wspaniale, jeśli zaplanujesz sobie któregoś dnia, że wykonasz całość, czyli wszystkie cztery części, ale na co dzień możesz wybrać którąkolwiek z części (bądź połączyć np. dwie dowolne) w zależności jakie są Twoje możliwości – czasowe jak i wydolnościowe.  Dzisiaj dzielę się z Wami częścią drugą z całości!  ODDECH I WZMOCNIENIE to druga część praktyki trwająca 23 minuty. Tutaj zaczynamy powoli, przechodzimy przez kilka Powitań Słońca, modyfikując je tak, aby wzmocnić kręgosłup, rozgrzać ramiona, zaktywizować brzuch i rozciągnąć kręgosłup. Mamy tutaj również połączenie dynamicznego ruchu z mocnym oddechem – coś co pięknie nas rozbudza i potrafi zastąpić podwójne espresso! Po serii dynamicznych ruchów przechodzimy do uspokojenia oddechu w pozycjach bardziej statycznych oraz serii ćwiczeń dla kręgosłupa w leżeniu na plecach.   Mamy zatem tutaj wszystko czego potrzebuje nasze ciało – zarówno dynamiczny ruch i mocny oddech jak i spokojniejsze tempo i rozciąganie ciała. Praktyka sama w sobie będzie wspaniałym rozpoczęciem dnia, gdy chcemy rozruszać ciało i podkręcić akcję naszego serca. Sprawdzi się również w ciągu dnia, gdy poczujemy potrzebę przerwy od pracy czy siedzenia i rozruszania ciała.  _______  Pozostańmy w kontakcie: INSTAGRAM - https://www.instagram.com/gosiamostow... FACEBOOK - https://www.facebook.com/mmostowskayoga/ WWW - http://mmyoga.pl/ BLOG - http://purestyle.pl/  Wspieraj mnie:  https://patronite.pl/mmyoga  🖤  Jeśli podobał Ci się ten film, daj mi proszę dużego lajka, wtedy wiem, że to co robię, pomaga innym!  Jeśli chcesz pozostać na bieżąco, subskrybuj mój kanał i bądź automatycznie powiadamiany o nowych filmach! :)   Do zobaczenia już wkrótce! Gosia ♥","https://www.youtube.com/watch?v=xdsHAtUNMJ0"
"Yin i Yang - Kojąca Joga dla Ciała, Umysłu i Ducha","Flow, Stres","24","Małgorzata Mostowska","Dwugodzinną praktykę dla całego ciała, o której wspominałam Wam na początku filmu, znajdziecie tutaj: https://mmyoga.pl/kurs/kurs-video/ _____________ Yin i Yang - kojąca joga dla ciała, umysłu i ducha, to praktyka, która wspaniale nada się na trudne dni czy momenty, w których potrzebujemy zaopiekowania i zadbania nie tylko o swoje ciało, ale również o duszę i głowę. Ta praktyka będzie cudowna na każdy dzień, w którym potrzebujesz ukojenia i spokojnego prowadzenia. Joga yin i yang to połączenie jogi łagodnej z bardziej dynamiczną. Rozgrzewamy troszkę ciało, aby móc później wejść w głębszy stan relaksu i odprężenia.  To trwająca 25-minut praktyka, która ma za zadanie ukoić nasze nerwy, rozruszać, ale jednocześnie zrelaksować ciało i wyciszyć umysł. Innymi słowy: naładować się cudowną, dobrą energią!  Będzie skupienie na oddechu oraz chwili która istnieje naprawdę - tu i teraz. Będzie kilka przejść w stylu flow, kilka nieco bardziej dynamicznych ruchów, przytulania, otwierania ciała oraz chwila na kontemplację otaczającej nas rzeczywistości.  Wszystko zależy od Was! Działajcie, dbajcie o siebie i o swój spokój wewnętrzny.  Ta praktyka będzie również odpowiednia dla początkujących, wybierajcie po prostu pozycje i ich modyfikacje, w których czujecie się dobrze i bezpiecznie. Możecie ją wykonać o poranku, wieczorem (przed snem) jak i w ciągu dnia, aby oderwać się od pracy czy codziennych obowiązków. Ta praktyka to wspaniale zainwestowane w siebie 15 minut!  Zapraszam na matę!  Muzyka:  Embrace by Purrple Cat | https://purrplecat.com Music promoted by https://www.free-stock-music.com Creative Commons Attribution-ShareAlike 3.0 Unported https://creativecommons.org/licenses/by-sa/3.0/deed.en_US  Pozostańmy w kontakcie: INSTAGRAM - https://www.instagram.com/gosiamostow... FACEBOOK - https://www.facebook.com/mmostowskayoga/ WWW - http://mmyoga.pl/ BLOG - http://purestyle.pl/  Wspieraj mnie:  https://patronite.pl/mmyoga  🖤  Jeśli podobał Ci się ten film, daj mi proszę dużego lajka, wtedy wiem, że to co robię, pomaga innym!  Jeśli chcesz pozostać na bieżąco, subskrybuj mój kanał i bądź automatycznie powiadamiany o nowych filmach! :)   Do zobaczenia już wkrótce! Gosia ♥","https://www.youtube.com/watch?v=UfpV5L_TAVk"
"Medytacja Wdzięczności - MOMENTY","Stres, Medytacja","15","Małgorzata Mostowska","MEDYTACJA WDZIĘCZNOŚCI - MOMENTY jest częścią kursu medytacyjnego WDZIĘCZNOŚĆ:  https://mmyoga.pl/kurs/kurs-wdziecznosci/  Po więcej szczegółów zapraszam do linku powyżej i na stronę: mmyoga.pl  Medytacja wdzięczności Momenty to medytacja trwająca nieco ponad 15 minut. To praktyka, która ma ukoić nasze nerwy oraz nastroić nasze myśli na dobre tory. To medytacja wdzięczności, którą możesz wykonać o poranku, w ciągu dnia lub tuż przed snem - aby wyciszyć umysł i zrelaksować ciało.  Medytacja wdzięczności to medytacja z której bardzo chętnie korzystacie. Postanowiłam stworzyć zatem cały Kurs Wdzięczności, czyli 7 medytacji, po jednej na każdy dzień, abyście mogli jeszcze bardziej zanurzyć się w swoim oddechu i temacie wdzięczności. To medytacje, po które będziecie mogli sięgnąć, gdy tylko poczujecie spadek energii lub zauważycie, że ciało stało się napięte, a myśli wędrują nie w tym kierunku, który Wam służy. Wszystkie medytacje zawierają w sobie wyciszające ćwiczenie oddechowe, afirmacje wdzięczności oraz czas dla Ciebie, na posłuchanie siebie i tego co Twoje serce chce Ci powiedzieć.    Ta praktyka jak i cały Kurs Wdzięczności będzie również odpowiednia dla początkujących osób, nawet takich, które nigdy nie medytowały (i myślą, że to nie dla nich),  jako że jest to medytacja prowadzona.   Zapraszam Was do mojego świata.  Pozostańmy w kontakcie: INSTAGRAM - https://www.instagram.com/gosiamostowska/ FACEBOOK - https://www.facebook.com/mmostowskayoga/ WWW - http://mmyoga.pl/ BLOG - http://purestyle.pl/ WSPÓŁPRACA: wspolpraca@mmyoga.pl   Wspieraj mnie:  https://patronite.pl/mmyoga  🖤  Muzyka: soundsofnidra.com  Jeśli podobał Ci się ten film, daj mi proszę dużego lajka, wtedy wiem, że to co robię, pomaga innym!  Jeśli chcesz pozostać na bieżąco, subskrybuj mój kanał i bądź automatycznie powiadamiany o nowych filmach! :)   Do zobaczenia już wkrótce! Gosia ♥","https://www.youtube.com/watch?v=Yv1CJtuK6X0"
"Medytacja Prowadzona - Dobre Relacje","Stres, Medytacja","12","Małgorzata Mostowska","Możesz już teraz rozpocząć 7-dniowy kurs medytacji - Wdzięczność, Spokój, Oddech wchodząc na stronę: https://mmyoga.pl/kurs/kurs-wdziecznosci/  Tam znajdziesz również więcej informacji dotyczących kursu wdzięczności. _______________________ Medytacja prowadzona - dobre relacje to medytacja, która ma przede wszystkim sprawić, że poczujemy się lepiej, poczujemy ulgę. Medytacja dobrych relacji ukoi nasze nerwy, zrelaksuje ciało i psychikę,  wyciszy umysł. To medytacja opierająca się na poczuciu wdzięczności, spokoju i miłości - do siebie i do innych.   Ta praktyka będzie również odpowiednia dla początkujących, jako że jest to medytacja prowadzona. Możecie ją wykonać o każdej porze dnia i nocy. Ta praktyka to wspaniale zainwestowane w siebie 12 minut!  Zapraszam Was do mojego świata.  Pozostańmy w kontakcie: INSTAGRAM - https://www.instagram.com/gosiamostow... FACEBOOK - https://www.facebook.com/mmostowskayoga/ WWW - http://mmyoga.pl/ BLOG - http://purestyle.pl/ WSPÓŁPRACA: wspolpraca@mmyoga.pl  Miejsce nagrania: Cortina d'Ampezzo, Włochy.  Wspieraj mnie:  https://patronite.pl/mmyoga  🖤  Muzyka: soundsofnidra.com/Divine Nature  Jeśli podobał Ci się ten film, daj mi proszę dużego lajka, wtedy wiem, że to co robię, pomaga innym!  Jeśli chcesz pozostać na bieżąco, subskrybuj mój kanał i bądź automatycznie powiadamiany o nowych filmach! :)   Do zobaczenia już wkrótce! Gosia ♥","https://www.youtube.com/watch?v=EPfiJ5YULmE"
"Łagodna Joga Księżycowa","Flow, Stres","15","Małgorzata Mostowska","Praktykę całego ciała, o której wspominałam Wam na początku będzie można już zakupić tutaj: https://mmyoga.pl/kurs/kurs-video/ _____________ Łagodna joga księżycowa to spokojna praktyka, która wspaniale nada się na tzw. księżycowe dni (nów, pełnia), ale tak naprawdę będzie cudowna również na każdy inny dzień, w którym potrzebujesz ukojenia i spokojnego prowadzenia. Joga księżycowa to 15-minutowa praktyka, która ma za zadanie ukoić nasze nerwy, rozruszać, ale jednocześnie zrelaksować ciało i wyciszyć umysł. Innymi słowy: naładować się cudowną, dobrą energią!  Będzie skupienie na oddechu oraz chwili która istnieje naprawdę - tu i teraz. Będzie kilka przejść w stylu flow, kilka nieco bardziej dynamicznych ruchów, przytulania, otwierania ciała oraz chwila na kontemplację otaczającej nas rzeczywistości.  Wszystko zależy od Was! Działajcie, dbajcie o siebie i o swój spokój wewnętrzny.  Ta praktyka będzie również odpowiednia dla początkujących, wybierajcie po prostu pozycje i ich modyfikacje, w których czujecie się dobrze i bezpiecznie. Możecie ją wykonać o poranku, wieczorem (przed snem) jak i w ciągu dnia, aby oderwać się od pracy czy codziennych obowiązków. Ta praktyka to wspaniale zainwestowane w siebie 15 minut!  Zapraszam na matę!  Muzyka: soundsofnidra.com/Zen Path Za pomoc w realizacji tego nagrania, ogromnie dziękuję Ani: https://www.instagram.com/morebyann/  Pozostańmy w kontakcie: INSTAGRAM - https://www.instagram.com/gosiamostow... FACEBOOK - https://www.facebook.com/mmostowskayoga/ WWW - http://mmyoga.pl/ BLOG - http://purestyle.pl/  Wspieraj mnie:  https://patronite.pl/mmyoga  🖤  Jeśli podobał Ci się ten film, daj mi proszę dużego lajka, wtedy wiem, że to co robię, pomaga innym!  Jeśli chcesz pozostać na bieżąco, subskrybuj mój kanał i bądź automatycznie powiadamiany o nowych filmach! :)   Do zobaczenia już wkrótce! Gosia ♥","https://www.youtube.com/watch?v=Qtl1gccIvxM"
"Wystarczająco Dobra - Spotkanie Autorskie w Warszawie","Inne","71","Małgorzata Mostowska","Kochani, zapraszam Was na spotkanie autorskie, z okazji premiery mojej pierwszej książki ""Wystarczająco dobra. O czułym podejściu do życia i drodze do samoakceptacji"", które poprowadziła wspaniała Agnieszka Cegielska.  Książkę możesz nabyć np. tutaj: https://tinyurl.com/3p2r6n38 W formie audiobooka np. tutaj: https://tinyurl.com/2hfunnwm  Dziękuję, że byliście ze mną!","https://www.youtube.com/watch?v=wWxQeQOiWVM"
"Joga na Stres - Wewnętrzna Moc i Dobry Nastrój","Flow, Stres","20","Małgorzata Mostowska","Joga na stres, wewnętrzną moc i dobry nastrój - to 20-minutowa praktyka, która ma za zadanie ukoić nasze nerwy, rozruszać, ale jednocześnie zrelaksować ciało i wyciszyć umysł. Innymi słowy: naładować się cudowną, dobrą energią!  Będzie skupienie na oddechu oraz chwili która istnieje naprawdę - tu i teraz. Będzie kilka przejść w stylu flow, kilka nieco bardziej dynamicznych ruchów, oraz chwila na kontemplację otaczającej nas rzeczywistości.  Wszystko zależy od Was! Działajcie, dbajcie o siebie i o swój spokój wewnętrzny.  Ta praktyka będzie również odpowiednia dla początkujących, wybierajcie po prostu pozycje i ich modyfikacje, w których czujecie się dobrze i bezpiecznie. Możecie ją wykonać o poranku, wieczorem (przed snem) jak i w ciągu dnia, aby oderwać się od pracy czy codziennych obowiązków. Ta praktyka to wspaniale zainwestowane w siebie 20 minut!  Zapraszam na matę!  Muzyka: soundsofnidra.com/Cosmic Energy Za pomoc w realizacji tego nagrania, ogromnie dziękuję Ani: https://www.instagram.com/morebyann/  Pozostańmy w kontakcie: INSTAGRAM - https://www.instagram.com/gosiamostowska/ FACEBOOK - https://www.facebook.com/mmostowskayoga/ WWW - http://mmyoga.pl/ BLOG - http://purestyle.pl/  Wspieraj mnie:  https://patronite.pl/mmyoga  🖤  Jeśli podobał Ci się ten film, daj mi proszę dużego lajka, wtedy wiem, że to co robię, pomaga innym!  Jeśli chcesz pozostać na bieżąco, subskrybuj mój kanał i bądź automatycznie powiadamiany o nowych filmach! :)   Do zobaczenia już wkrótce! Gosia ♥","https://www.youtube.com/watch?v=xKGK6g0fccA"
"Medytacja Wdzięczności - na Zakończenie Dnia (Przed Snem)","Medytacja, Stres, Wieczór","15","Małgorzata Mostowska","Medytacja wdzięczności na zakończenie dnia  to 15-minutowa praktyka, która ma za zadanie ukoić nasze nerwy, zrelaksować ciało oraz wyciszyć umysł. To medytacja wdzięczności, którą dobrze jest wykonać wieczorem - przed snem.  Medytacja wdzięczności to medytacja z której bardzo chętnie korzystacie. Postanowiłam stworzyć zatem medytację wdzięczności, która byłaby idealna na wieczór. Medytację, po którą będziecie mogli sięgnąć, gdy po całym dniu poczujecie, że chcecie doładować się dobrą energią i spokojnie zasnąć. Medytację, która będzie zawierała w sobie wyciszające ćwiczenie oddechowe, afirmacje wdzięczności oraz czas dla Ciebie, na posłuchanie siebie i tego co Twoje serce chce Ci powiedzieć.    Ta praktyka będzie również odpowiednia dla początkujących, jako że jest to medytacja prowadzona. Możecie ją wykonać o każdej porze dnia i nocy, jednak zdecydowanie najbardziej polecam wykonać ją wieczorem (przed snem). Ta praktyka to wspaniale zainwestowane w siebie 15 minut!  Zapraszam Was do mojego świata.  Pozostańmy w kontakcie: INSTAGRAM - https://www.instagram.com/gosiamostowska/ FACEBOOK - https://www.facebook.com/mmostowskayoga/ WWW - http://mmyoga.pl/ BLOG - http://purestyle.pl/ WSPÓŁPRACA: wspolpraca@mmyoga.pl  Za pomoc w realizacji i nagraniu praktyki dziękuję Ani: https://www.instagram.com/travelstoriespl/  Wspieraj mnie:  https://patronite.pl/mmyoga  🖤  Muzyka: soundsofnidra.com  Jeśli podobał Ci się ten film, daj mi proszę dużego lajka, wtedy wiem, że to co robię, pomaga innym!  Jeśli chcesz pozostać na bieżąco, subskrybuj mój kanał i bądź automatycznie powiadamiany o nowych filmach! :)   Do zobaczenia już wkrótce! Gosia ♥","https://www.youtube.com/watch?v=9yhK_02jcHE"
