"title","category","duration","channel","description","url"
"Lekcja jogi na stojąco – joga bez maty, idealna na wakacje i do ćwiczeń na trawie! | POZIOM ★★☆☆|","Stres, Rozciąganie","22","Yoga Home","Szukasz prostych ćwiczeń jogi, które możesz wykonać wszędzie, nawet bez maty? Ta lekcja jogi na stojąco to idealny wybór dla Ciebie! Ten trening jogi nie wymaga żadnego sprzętu – wystarczy odrobina wolnej przestrzeni, np. na trawie podczas wakacji, w ogrodzie lub w domu.  W tym filmie znajdziesz: -Joga na stojąco – ćwiczenia wzmacniające i rozciągające całe ciało -Trening bez maty – idealny na wyjazd, do parku, na plażę i wszędzie tam, gdzie nie masz maty -Proste pozycje jogi dla początkujących i średniozaawansowanych -Aktywny styl życia – szybki sposób na ruch i relaks w dowolnym miejscu  Ta lekcja to świetny sposób, by zadbać o zdrowie, poprawić postawę i rozluźnić ciało – nawet jeśli jesteś w podróży lub nie masz dostępu do sprzętu. Regularna praktyka jogi pomaga wzmocnić mięśnie, zwiększyć elastyczność i zredukować stres.  #joga #treningwdomu #aktywnystylżycia  🙏 Jeżeli doceniasz naszą pracę wesprzyj nas. Przeczytaj jak można to zrobić: https://yogahome.pl/wsparcie/ _______________________________________________ 🧨 Co nas wyróżnia? Możesz być z nami na żywo! W trakcie transmisji możesz zadawać pytania w komentarzach i od razu dostać na nie odpowiedź. Możesz również porozmawiać z nami po zajęciach! Zobacz nasz grafik https://yogahome.pl/joga-online/ _______________________________________________ 💻 https://yogahome.pl https://www.instagram.com/yogahome.pl/ https://www.facebook.com/yogahomepl _______________________________________________ ❗ Pamiętaj, żeby wszystko robić w zgodzie ze swoim ciałem! ❤️ Polub film i subskrybuj kanał po więcej jogi dostosowanej do Ciebie!","https://www.youtube.com/watch?v=aI8ppkpckys"
"Skuteczny sposób by przestać się garbić | Proste ćwiczenia | POZIOM ★☆☆☆|","Inne","16","Yoga Home","Witaj na naszym kanale! W tym filmie pokażemy Ci prostą i skuteczną lekcję jogi, która pomoże Ci przestać się garbić. Ćwiczenia są przeznaczone dla każdego – niezależnie od wieku i poziomu zaawansowania.  Dzięki regularnej praktyce wzmocnisz mięśnie pleców, rozciągniesz spięte barki i klatkę piersiową oraz poprawisz swoją postawę. To idealny sposób na walkę z bólem pleców i złymi nawykami siedzącymi, które prowadzą do garbienia się.  Co znajdziesz w filmie? -Proste ćwiczenia jogi na poprawę postawy -Techniki rozciągania barków i klatki piersiowej -Wzmacnianie mięśni pleców dla lepszej stabilizacji -Porady, jak unikać garbienia się na co dzień  🙏 Jeżeli doceniasz naszą pracę wesprzyj nas. Przeczytaj jak można to zrobić: https://yogahome.pl/wsparcie/ _______________________________________________ 🧨 Co nas wyróżnia? Możesz być z nami na żywo! W trakcie transmisji możesz zadawać pytania w komentarzach i od razu dostać na nie odpowiedź. Możesz również porozmawiać z nami po zajęciach! Zobacz nasz grafik https://yogahome.pl/joga-online/ _______________________________________________ 💻 https://yogahome.pl https://www.instagram.com/yogahome.pl/ https://www.facebook.com/yogahomepl _______________________________________________ ❗ Pamiętaj, żeby wszystko robić w zgodzie ze swoim ciałem! ❤️ Polub film i subskrybuj kanał po więcej jogi dostosowanej do Ciebie!","https://www.youtube.com/watch?v=kgwudnRS2hg"
"Stopa Point - Rozciąganie grzbietów stóp | Joga na stopy | POZIOM ★★☆☆|","Rozciąganie","34","Yoga Home","Szukasz skutecznego i prostego sposobu na domowy trening, który poprawi Twoją sprawność, mobilność i zdrowie? Ten film to idealna propozycja dla wszystkich, którzy cenią aktywność fizyczną, zdrowy styl życia i chcą zadbać o siebie bez wychodzenia z domu. Odkryj lekcję jogi skoncentrowaną na rozciąganiu grzbietów stóp – kluczowego elementu dla osób uprawiających sport, tańczących, biegających czy po prostu dbających o swoje ciało.  Dlaczego warto ćwiczyć w domu z nami? -Oszczędzasz czas i pieniądze – nie potrzebujesz sprzętu ani karnetu na siłownię. -Możesz ćwiczyć o dowolnej porze, dostosowując trening do własnego grafiku. -Zyskujesz dostęp do sprawdzonych technik i wskazówek, które poprawią Twoją codzienną aktywność i samopoczucie.  Dla kogo jest ten film? -Dla osób aktywnych fizycznie: sportowców, biegaczy, tancerzy, miłośników fitnessu. -Dla wszystkich, którzy chcą zadbać o zdrowie stóp, poprawić mobilność i uniknąć urazów. -Dla entuzjastów jogi, pilatesu i zdrowego stylu życia.  #joga #treningwdomu #zdrowystylżycia #rozciąganie #ćwiczeniawdomu #aktywni #zdrowestopy #sport #jogadlakażdego  🙏 Jeżeli doceniasz naszą pracę wesprzyj nas. Przeczytaj jak można to zrobić: https://yogahome.pl/wsparcie/ _______________________________________________ 🧨 Co nas wyróżnia? Możesz być z nami na żywo! W trakcie transmisji możesz zadawać pytania w komentarzach i od razu dostać na nie odpowiedź. Możesz również porozmawiać z nami po zajęciach! Zobacz nasz grafik https://yogahome.pl/joga-online/ _______________________________________________ 💻 https://yogahome.pl https://www.instagram.com/yogahome.pl/ https://www.facebook.com/yogahomepl _______________________________________________ ❗ Pamiętaj, żeby wszystko robić w zgodzie ze swoim ciałem! ❤️ Polub film i subskrybuj kanał po więcej jogi dostosowanej do Ciebie!","https://www.youtube.com/watch?v=3KJhnWKPPOQ"
"JOGA DYNAMICZNE FLOW dla początkujących | POZIOM ★☆☆☆ |","Flow","25","Yoga Home","Zapraszam na 25-minutową lekcję jogi do ćwiczenia w domu, prowadzoną metodą rampy – stopniowo narastające flow, które z każdym powtórzeniem wzbogacamy o kolejną asanę. Ta praktyka jest idealna dla osób początkujących. Płynna, wdechowo-wydechowa sekwencja pozwoli Ci zanurzyć się w medytacyjnym, lekko transowym charakterze jogi.  Ten film jest świetny dla osób aktywnych, które chcą wzmocnić ciało i umysł, a także dla praktykujących jogę, pilates i podobne dyscypliny, szukających ciekawej i dynamicznej, ale efektywnej praktyki jogi w domu.  🙏 Jeżeli doceniasz naszą pracę wesprzyj nas. Przeczytaj jak można to zrobić: https://yogahome.pl/wsparcie/ _______________________________________________ 🧨 Co nas wyróżnia? Możesz być z nami na żywo! W trakcie transmisji możesz zadawać pytania w komentarzach i od razu dostać na nie odpowiedź. Możesz również porozmawiać z nami po zajęciach! Zobacz nasz grafik https://yogahome.pl/joga-online/ _______________________________________________ 💻 https://yogahome.pl https://www.instagram.com/yogahome.pl/ https://www.facebook.com/yogahomepl _______________________________________________ ❗ Pamiętaj, żeby wszystko robić w zgodzie ze swoim ciałem! ❤️ Polub film i subskrybuj kanał po więcej jogi dostosowanej do Ciebie!","https://www.youtube.com/watch?v=uO0Xyjw5Dwg"
"Trening MOBILITY dla każdego | POZIOM ★☆☆☆ |","Rozciąganie","34","Yoga Home","Jeśli czujesz ograniczenia ruchowe i masz wrażenie, że Twoje ciało jest jak z drewna to ten trening w domu jest idealny dla Cb. Zrób szybki trening i poczuj więcej swobody w ciele w zaledwie 30 min. Ćwiczenia odpowiednie dla osób początkujących, które odczuwają dyskomfort podczas kucania, schylania się czy chodzenia po schodach. Te proste ćwiczenia w domu pomogą Ci zadbać o zakresy ruchu co przełoży się na funkcjonowanie bez bólu ( albo z mniejszym bólem).   🙏 Jeżeli doceniasz naszą pracę wesprzyj nas. Przeczytaj jak można to zrobić: https://yogahome.pl/wsparcie/ _______________________________________________ 🧨 Co nas wyróżnia? Możesz być z nami na żywo! W trakcie transmisji możesz zadawać pytania w komentarzach i od razu dostać na nie odpowiedź. Możesz również porozmawiać z nami po zajęciach! Zobacz nasz grafik https://yogahome.pl/joga-online/ _______________________________________________ 💻 https://yogahome.pl https://www.instagram.com/yogahome.pl/ https://www.facebook.com/yogahomepl _______________________________________________ ❗ Pamiętaj, żeby wszystko robić w zgodzie ze swoim ciałem! ❤️ Polub film i subskrybuj kanał po więcej jogi dostosowanej do Ciebie!","https://www.youtube.com/watch?v=21gmJiy-7BM"
"Joga po Bieganiu i Rowerze – 40 min Łatwa Lekcja Jogi | POZIOM ★☆☆☆ |","Rozciąganie","39","Yoga Home","Witaj w łatwej, 40-minutowej lekcji jogi stworzonej specjalnie dla biegaczy, rowerzystów i wszystkich osób aktywnych fizycznie! Jeśli szukasz skutecznego sposobu, by rozluźnić ciało po treningu, uniknąć kontuzji i zadbać o regenerację – ta sesja jest dla Ciebie.  Podczas tej lekcji jogi skupimy się na rozciąganiu kluczowych partii mięśniowych, które najczęściej są napięte po bieganiu i jeździe na rowerze. Łagodne asany pomogą Ci zrelaksować się, poprawić elastyczność i zmniejszyć ryzyko kontuzji. Sesja jest łatwa do wykonania w domu i odpowiednia dla osób na każdym poziomie zaawansowania – nawet jeśli dopiero zaczynasz swoją przygodę z jogą.  W tej lekcji jogi znajdziesz: 🔸Rozciąganie nóg, bioder i pleców – idealne po bieganiu i jeździe na rowerze. 🔸Relaksujące pozycje – pomogą Ci się wyciszyć i zregenerować 🔸Profilaktykę kontuzji – wzmocnisz mięśnie stabilizujące i poprawisz mobilność. 🔸Łatwe ćwiczenia do wykonania w domu – nie potrzebujesz żadnego specjalistycznego sprzętu.  Dla kogo jest ta lekcja?  🔹Biegaczy i rowerzystów – zadbaj o swoje ciało po treningu. 🔹Osoby trenujące w domu – wykorzystaj jogę jako uzupełnienie codziennej aktywności. 🔹Każdy, kto chce uniknąć kontuzji – wzmocnij ciało i popraw swoją wydolność. 🔹Szukający rozluźnienia i relaksu – zregeneruj się po ciężkim dniu lub treningu.  #jogadlabiegaczy #jogadlarowerzystów #jogawdomu #rozciaganie #relaks #profilaktykakontuzji  🙏 Jeżeli doceniasz naszą pracę wesprzyj nas. Przeczytaj jak można to zrobić: https://yogahome.pl/wsparcie/ _______________________________________________ 🧨 Co nas wyróżnia? Możesz być z nami na żywo! W trakcie transmisji możesz zadawać pytania w komentarzach i od razu dostać na nie odpowiedź. Możesz również porozmawiać z nami po zajęciach! Zobacz nasz grafik https://yogahome.pl/joga-online/ _______________________________________________ 💻 https://yogahome.pl https://www.instagram.com/yogahome.pl/ https://www.facebook.com/yogahomepl _______________________________________________ ❗ Pamiętaj, żeby wszystko robić w zgodzie ze swoim ciałem! ❤️ Polub film i subskrybuj kanał po więcej jogi dostosowanej do Ciebie!","https://www.youtube.com/watch?v=i7so044VZQE"
"Praktyka Jogi 25 min - skręty kręgosłupa | POZIOM ★★☆☆ |","Kręgosłup, Stres, Rozciąganie, Siła","24","Yoga Home","Zapraszam Cię na wyjątkową, 25-minutową lekcję jogi do samodzielnego wykonania w domu! Ta praktyka jogi online jest idealna dla każdego, kto chce zadbać o zdrowy styl życia, poprawić elastyczność ciała oraz zrelaksować umysł po ciężkim dniu. Skupiamy się na skrętach kręgosłupa w różnych asanach, co pozwala rozluźnić napięcia, poprawić mobilność pleców i wzmocnić je.   Co zyskasz dzięki tej lekcji jogi? 🔸Poprawę elastyczności i mobilności kręgosłupa 🔸Głębokie rozciąganie całego ciała 🔸Redukcję napięć i bólu pleców 🔸Wzmocnienie mięśni głębokich 🔸Relaks i wyciszenie umysłu  🙏 Jeżeli doceniasz naszą pracę wesprzyj nas. Przeczytaj jak można to zrobić: https://yogahome.pl/wsparcie/ _______________________________________________ 🧨 Co nas wyróżnia? Możesz być z nami na żywo! W trakcie transmisji możesz zadawać pytania w komentarzach i od razu dostać na nie odpowiedź. Możesz również porozmawiać z nami po zajęciach! Zobacz nasz grafik https://yogahome.pl/joga-online/ _______________________________________________ 💻 https://yogahome.pl https://www.instagram.com/yogahome.pl/ https://www.facebook.com/yogahomepl _______________________________________________ ❗ Pamiętaj, żeby wszystko robić w zgodzie ze swoim ciałem! ❤️ Polub film i subskrybuj kanał po więcej jogi dostosowanej do Ciebie!","https://www.youtube.com/watch?v=oV3kRJ0wZ0w"
"Trening MOBILITY dla Początkujących  | POZIOM ★☆☆☆ |","Rozciąganie","34","Yoga Home","Jeśli czujesz ograniczenia ruchowe i masz wrażenie, że Twoje ciało jest jak z drewna to ten trening w domu jest idealny dla Cb. Zrób szybki trening i poczuj więcej swobody w ciele w zaledwie 30 min. Ćwiczenia odpowiednie dla osób początkujących, które odczuwają dyskomfort podczas kucania, schylania się czy chodzenia po schodach. Te proste ćwiczenia w domu pomogą Ci zadbać o zakresy ruchu co przełoży się na funkcjonowanie bez bólu ( albo z mniejszym bólem).   🙏 Jeżeli doceniasz naszą pracę wesprzyj nas. Przeczytaj jak można to zrobić: https://yogahome.pl/wsparcie/ _______________________________________________ 🧨 Co nas wyróżnia? Możesz być z nami na żywo! W trakcie transmisji możesz zadawać pytania w komentarzach i od razu dostać na nie odpowiedź. Możesz również porozmawiać z nami po zajęciach! Zobacz nasz grafik https://yogahome.pl/joga-online/ _______________________________________________ 💻 https://yogahome.pl https://www.instagram.com/yogahome.pl/ https://www.facebook.com/yogahomepl _______________________________________________ ❗ Pamiętaj, żeby wszystko robić w zgodzie ze swoim ciałem! ❤️ Polub film i subskrybuj kanał po więcej jogi dostosowanej do Ciebie!","https://www.youtube.com/watch?v=2Rp1JusB1d0"
"Pozbądź się Bólu Barków, Szyi i Karku | Łatwe Ćwiczenia na Krześle dla Każdego | 25 min","Kręgosłup, Wieczór","19","Yoga Home","Szukasz skutecznych ćwiczeń na bolące barki, sztywną szyję, ból karku lub zgarbioną sylwetkę? Ten 25-minutowy zestaw ćwiczeń na krześle to idealna propozycja dla seniorów, osób po kontuzjach oraz wszystkich, którzy mają ograniczoną mobilność w obręczy barkowej. W filmie znajdziesz bezpieczne i łatwe ćwiczenia na barki, szyję i kark, które pomagają zmniejszyć napięcie, poprawić postawę i zwiększyć zakres ruchu – wszystko bez wstawania z krzesła.  W programie: 🔸Delikatna mobilizacja barków i szyi 🔸Ćwiczenia rozciągające na krześle 🔸Proste techniki poprawiające postawę i łagodzące ból karku 🔸Trening odpowiedni dla początkujących, seniorów i osób po urazach  Regularne wykonywanie tych ćwiczeń pomaga zmniejszyć ból barków, rozluźnić mięśnie szyi, poprawić mobilność i zapobiegać zgarbionej sylwetce. Zadbaj o zdrowe barki i szyję bez wychodzenia z domu!  ✔️ Ćwiczenia na ból barku ✔️ Mobilizacja obręczy barkowej ✔️ Trening na sztywność karku ✔️ Ćwiczenia na krześle dla seniorów ✔️ Poprawa postawy i ruchomości  #bólbarku #bólkarku #bólszyi #mobilizacjabarków #ćwiczenianakrześle #seniorzy #rehabilitacja #zdrowie #postawa #odcinekszyjnykręgosłupa  🙏 Jeżeli doceniasz naszą pracę wesprzyj nas. Przeczytaj jak można to zrobić: https://yogahome.pl/wsparcie/ _______________________________________________ 🧨 Co nas wyróżnia? Możesz być z nami na żywo! W trakcie transmisji możesz zadawać pytania w komentarzach i od razu dostać na nie odpowiedź. Możesz również porozmawiać z nami po zajęciach! Zobacz nasz grafik https://yogahome.pl/joga-online/ _______________________________________________ 💻 https://yogahome.pl https://www.instagram.com/yogahome.pl/ https://www.facebook.com/yogahomepl _______________________________________________ ❗ Pamiętaj, żeby wszystko robić w zgodzie ze swoim ciałem! ❤️ Polub film i subskrybuj kanał po więcej jogi dostosowanej do Ciebie!","https://www.youtube.com/watch?v=t3n063AVm5E"
"Yoga Wheel - wygięcia z kołem do jogi  | POZIOM ★★☆☆ |","Kręgosłup, Rozciąganie","19","Yoga Home","Odkryj, jak wykorzystać koło do jogi (yoga wheel) w praktyce aby pogłębić wygięcia. Koło do jogi to doskonałe narzędzie, które pomaga otworzyć klatkę piersiową, zwiększyć elastyczność kręgosłupa oraz poprawić postawę. Dzięki tej sesji nauczysz się, jak prawidłowo korzystać z yoga wheel, aby pogłębić wygięcia oraz rozciągnąć klatkę piersiową.  #yogawheel #kołodojogi #rozciąganie #stretching #mobility   🙏 Jeżeli doceniasz naszą pracę wesprzyj nas. Przeczytaj jak można to zrobić: https://yogahome.pl/wsparcie/ _______________________________________________ 🧨 Co nas wyróżnia? Możesz być z nami na żywo! W trakcie transmisji możesz zadawać pytania w komentarzach i od razu dostać na nie odpowiedź. Możesz również porozmawiać z nami po zajęciach! Zobacz nasz grafik https://yogahome.pl/joga-online/ _______________________________________________ 💻 https://yogahome.pl https://www.instagram.com/yogahome.pl/ https://www.facebook.com/yogahomepl _______________________________________________ ❗ Pamiętaj, żeby wszystko robić w zgodzie ze swoim ciałem! ❤️ Polub film i subskrybuj kanał po więcej jogi dostosowanej do Ciebie!","https://www.youtube.com/watch?v=PRLZRUuP8Lk"
"Przygotowanie do Stania Na Głowie | POZIOM ★★☆☆ |","Siła","36","Yoga Home","Lekcja jogi, która pomoże Ci wzmocnić ciało i nauczyć się bezpiecznego stania na głowie! Ten trening jogi wzmacniającej jest idealny dla osób ćwiczących w domu, które chcą poprawić równowagę, siłę i przygotować ciało na bezpieczne wykonanie stania na głowie. Dowiedz się krok po kroku, jak przygotować ciało do stanie na głowie, poznaj ćwiczenia wzmacniające mięśnie ramion oraz core.  #joga #jogawzmacniająca #ćwiczeniawdomu #jogawdomu #jogapolska  #naukastanianagłowie #stanienagłowie  🙏 Jeżeli doceniasz naszą pracę wesprzyj nas. Przeczytaj jak można to zrobić: https://yogahome.pl/wsparcie/ _______________________________________________ 🧨 Co nas wyróżnia? Możesz być z nami na żywo! W trakcie transmisji możesz zadawać pytania w komentarzach i od razu dostać na nie odpowiedź. Możesz również porozmawiać z nami po zajęciach! Zobacz nasz grafik https://yogahome.pl/joga-online/ _______________________________________________ 💻 https://yogahome.pl https://www.instagram.com/yogahome.pl/ https://www.facebook.com/yogahomepl _______________________________________________ ❗ Pamiętaj, żeby wszystko robić w zgodzie ze swoim ciałem! ❤️ Polub film i subskrybuj kanał po więcej jogi dostosowanej do Ciebie!","https://www.youtube.com/watch?v=_crF02W2WOI"
"Joga na ciężkie i zmęczone nogi – 20 minut ulgi po pracy | POZIOM ★★☆☆ |","Rozciąganie","22","Yoga Home","Odczuwasz ciężkość nóg po całym dniu w pracy? Ta 20-minutowa lekcja jogi w domu pomoże Ci zredukować uczucie zmęczenia, poprawić krążenie i przynieść ulgę zmęczonym nogom. Ćwiczenia są idealne dla osób z siedzącym lub stojącym trybem pracy, problemami krążeniowymi czy po dniu w niewygodnych butach.  W tej sesji znajdziesz rozciąganie nóg oraz ćwiczenia poprawiające komfort ruchu i krążenie. Zadbaj o swoje nogi i poczuj różnicę już po pierwszym treningu! Lekcja prowadzona po polsku, dostępna za darmo na naszym kanale.  #nogi #jogawdomu #jogapolska #ćwiczeniawdomu #ulgadlanóg #krążenie #joga #zdrowie #zdrowenawyki #zdrowystylżycia #praktykajogi   🙏 Jeżeli doceniasz naszą pracę wesprzyj nas. Przeczytaj jak można to zrobić: https://yogahome.pl/wsparcie/ _______________________________________________ 🧨 Co nas wyróżnia? Możesz być z nami na żywo! W trakcie transmisji możesz zadawać pytania w komentarzach i od razu dostać na nie odpowiedź. Możesz również porozmawiać z nami po zajęciach! Zobacz nasz grafik https://yogahome.pl/joga-online/ _______________________________________________ 💻 https://yogahome.pl https://www.instagram.com/yogahome.pl/ https://www.facebook.com/yogahomepl _______________________________________________ ❗ Pamiętaj, żeby wszystko robić w zgodzie ze swoim ciałem! ❤️ Polub film i subskrybuj kanał po więcej jogi dostosowanej do Ciebie!","https://www.youtube.com/watch?v=ExSI6rPRFu0"
"Łagodne ćwiczenia na bolące kolana | Masaż, rozciąganie, ćwiczenia na krześle | 25 min rehabilitacji","Rozciąganie","27","Yoga Home","Zapraszam na 25-minutowy zestaw łatwych ćwiczeń na bolące kolana, idealny dla osób szukających skutecznej rehabilitacji w domu. W filmie znajdziesz masaż okolicy kolana, ćwiczenia w siadzie na krześle oraz rozciąganie, które pomagają zmniejszyć ból i poprawić ruchomość stawu. Ten program jest odpowiedni dla początkujących i osób z problemami takimi jak zwyrodnienia, chondromalacja czy kolano biegacza.   ✔️ Masaż kolana ✔️ Ćwiczenia rehabilitacyjne na siedząco ✔️ Rozciąganie i mobilizacja kolan ✔️ Łatwe ćwiczenia na ból kolana ✔️ Rehabilitacja kolan w domu  #bólkolana #bólnogi #stawy #joga #zdrowystylżycia #zdrowenawyki #rehabilitacja #kolano #zdrowie   💰 Jeżeli doceniasz naszą pracę wesprzyj nas. Przeczytaj jak można to zrobić: https://yogahome.pl/wsparcie/  ❗❗ Pamiętaj, żeby wszystko robić w zgodzie ze swoim ciałem! ❤️ Podobało Ci się? Zostaw kciuka w górę i komentarz!","https://www.youtube.com/watch?v=u9wqsedlgm8"
"JOGA 30 min 🧘 Otwarcie Klatki Piersiowej | POZIOM ★★☆☆ |","Flow, Rozciąganie","31","Yoga Home","30 minutowa praktyka jogi w stylu vinyasa skoncentrowana na otwieraniu klatki piersiowej. Idealna sesja jogi dla osób, które się garbią, dużo siedzą lub odczuwają spięcie w okolicy obręczy barkowej.  #joga #vinyasa #mobility #praktykajogi #zdrowystylżycia #zdrowie #rozciąganie   🙏 Jeżeli doceniasz naszą pracę wesprzyj nas. Przeczytaj jak można to zrobić: https://yogahome.pl/wsparcie/ _______________________________________________ 🧨 Co nas wyróżnia? Możesz być z nami na żywo! W trakcie transmisji możesz zadawać pytania w komentarzach i od razu dostać na nie odpowiedź. Możesz również porozmawiać z nami po zajęciach! Zobacz nasz grafik https://yogahome.pl/joga-online/ _______________________________________________ 💻 https://yogahome.pl https://www.instagram.com/yogahome.pl/ https://www.facebook.com/yogahomepl _______________________________________________ ❗ Pamiętaj, żeby wszystko robić w zgodzie ze swoim ciałem! ❤️ Polub film i subskrybuj kanał po więcej jogi dostosowanej do Ciebie!","https://www.youtube.com/watch?v=_F2nqknHzzM"
"💪 Full Body Yoga – Wzmacniająca Praktyka na Całe Ciało! | POZIOM ★★☆☆ |","Rozciąganie, Flow, Siła","55","Yoga Home","Przygotuj się na kompleksowy trening jogi, który wzmocni Twoje ciało od stóp do głów! Sesja jogi wzmacniającej na całe ciało.  🔥 Co Cię czeka? ✔ Wzmacnianie core – mocny środek ciała ✔ Aktywacja nóg i pośladków – stabilna baza ✔ Wzmocnienie ramion i pleców – lepsza postawa ✔ Równowaga i koordynacja – płynność ruchów  💡 Dla kogo? Dla średniozaawansowanych  Dla tych, którzy chcą łączyć siłę z gibkością Dla szukających alternatywy dla siłowni  ❤️ Polub i subskrybuj po więcej treningów full body! 🔔 Włącz powiadomienia, by nie przegapić nowości.  #PowerYoga #FullBodyWorkout #JogaNaSiłę #SilneCiało #JogaDlaFormy  💰 Jeżeli doceniasz naszą pracę wesprzyj nas.  Przeczytaj jak można to zrobić: https://yogahome.pl/wsparcie/  ❗❗❗ ALBUM 777 ASAN ❗❗❗  Nasza książka dostępna w sprzedaży  https://yogahome.pl/sklep/akcesoria/album-777-asan/  ______________________________________________ NASZE KURSY ONLINE:  ✔️ 10h Kurs Vinyasa Joga dla początkujących https://yogahome.pl/sklep/kursy/kurs-jogi-dla-poczatkujacych/  ✔️ NIE GARB SIĘ!  https://yogahome.pl/sklep/kursy/nie-garb-sie/  ✔️ 2,5 h Warsztat dla bioder https://yogahome.pl/sklep/zajecia-online/praktyka-mobilne-biodra/  ✔️2,5 h Warsztat ze skłonów https://yogahome.pl/sklep/zajecia-online/praktyka-sklony/  ✔️ 2,5 h Warsztat z wygięć  https://yogahome.pl/sklep/zajecia-online/praktyka-wygiecia/  ✔️ 2,5 h Warsztat ze szpagatu https://yogahome.pl/sklep/zajecia-online/praktyka-tematyczna-szpagat/  ✔️ 2,5 h Warsztat z Gołębia Królewskiego  https://yogahome.pl/sklep/zajecia-online/praktyka-tematyczna-golab/  ______________________________________________ 🎥 Nadajemy na żywo GRAFIK: https://yogahome.pl/joga-online/ ______________________________________________ Różne poziomy trudności: ★☆☆☆ początkujący ★★☆☆ średnio-zaawansowany ★★★☆ zaawansowany ★★★★ Wow! _______________________________________________ 🏆 Co nas wyróżnia??? Możesz być z nami na żywo!!! W trakcie transmisji możesz zadawać pytania w komentarzach i od razu dostać na nie odpowiedź. Możesz również porozmawiać z nami po zajęciach! _______________________________________________ ✅ NASZ SKLEP: https://yogahome.pl/sklep/ ✅ INSTAGRAM: https://www.instagram.com/yogahome.pl/ ✅ FACEBOOK: https://www.facebook.com/yogahomepl ________________________________________________ ❗❗ Pamiętaj, żeby wszystko robić w zgodzie ze swoim ciałem! ❤️ Podobało Ci się? Zostaw kciuka w górę i komentarz!","https://www.youtube.com/watch?v=wRFsTrkQWqo"
